{
  "project": "sum-three-example",
  "code_sha256": "133b23137e9fb81e566540a0239c4606b5b2a9bcc09d3cdf06dfce37bee82c25",
  "environment_sha256": "e8679a70ab8b9b19c225a09dbebfc071a6facb10ec5703180ccdc06010a722c3",
  "parameters_sha256": "1f3aa772dd5ecd94d5ec8f979d61ac1f786998469f80e09a746f8169d9da5f7a",
  "inputs_sha256": {
    "input.txt": "14c5e74c4b96ccef41cd94db73a9ec3348038ac094feca4fd897cecffa07cdae",
    "requirements.lock": "6138c7ed534772d9b246f5c8417e3484bcfddc24e2980cf38efdb71a2e682941"
  }
}
